<?xml version="1.0" encoding="UTF-8"?>
<list xmlns:xsi="http://www.w3.org/2001/XMLSchema-instance" xmlns="http://l2j.org" xsi:schemaLocation="http://l2j.org items.xsd">
    <weapon id="7900" name="Ice Storm Hammer" icon="icon.weapon_ice_storm_hammer_i00">
        <!-- Can bestow 1 regular Soul Crystal and 1 Special Soul Crystal. -->
        <set name="weapon_type" val="BLUNT"/>
        <set name="bodypart" val="lrhand"/>
        <set name="damage_range" val="0;0;44;120"/>
        <set name="immediate_effect" val="true"/>
        <set name="crystal_count" val="1157"/>
        <set name="crystal_type" val="B"/>
        <set name="weight" val="1950"/>
        <set name="price" val="8680000"/>
        <set name="soulshots" val="1"/>
        <set name="spiritshots" val="1"/>
        <set name="enchant_enabled" val="1"/>
        <set name="commissionItemType" val="TWO_HAND_BLUNT_WEAPON"/>
        <stats>
            <stat type="pAtk">213</stat>
            <stat type="mAtk">91</stat>
            <stat type="rCrit">6</stat>
            <stat type="accCombat">8</stat>
            <stat type="pAtkSpd">325</stat>
            <stat type="randomDamage">20</stat>
            <stat type="pAtkRange">40</stat>
        </stats>
    </weapon>
    <weapon id="7901" name="Star Buster" icon="icon.weapon_star_buster_i00">
        <!-- Can bestow 1 regular Soul Crystal and 1 Special Soul Crystal. -->
        <set name="weapon_type" val="BLUNT"/>
        <set name="bodypart" val="lrhand"/>
        <set name="damage_range" val="0;0;44;120"/>
        <set name="immediate_effect" val="true"/>
        <set name="crystal_count" val="1746"/>
        <set name="crystal_type" val="B"/>
        <set name="weight" val="1930"/>
        <set name="price" val="13100000"/>
        <set name="soulshots" val="1"/>
        <set name="spiritshots" val="1"/>
        <set name="enchant_enabled" val="1"/>
        <set name="commissionItemType" val="TWO_HAND_BLUNT_WEAPON"/>
        <stats>
            <stat type="pAtk">236</stat>
            <stat type="mAtk">99</stat>
            <stat type="rCrit">6</stat>
            <stat type="accCombat">8</stat>
            <stat type="pAtkSpd">325</stat>
            <stat type="randomDamage">20</stat>
            <stat type="pAtkRange">40</stat>
        </stats>
    </weapon>
    <weapon id="7902" name="Doom Crusher" icon="icon.weapon_doom_crusher_i00">
        <!-- Can bestow 1 regular Soul Crystal and 1 Special Soul Crystal. -->
        <set name="weapon_type" val="BLUNT"/>
        <set name="bodypart" val="lrhand"/>
        <set name="damage_range" val="0;0;44;120"/>
        <set name="immediate_effect" val="true"/>
        <set name="crystal_count" val="1659"/>
        <set name="crystal_type" val="A"/>
        <set name="weight" val="1900"/>
        <set name="price" val="20741000"/>
        <set name="soulshots" val="1"/>
        <set name="spiritshots" val="1"/>
        <set name="commissionItemType" val="TWO_HAND_BLUNT_WEAPON"/>
        <set name="enchant_enabled" val="1"/>
        <stats>
            <stat type="pAtk">282</stat>
            <stat type="mAtk">114</stat>
            <stat type="rCrit">6</stat>
            <stat type="accCombat">8</stat>
            <stat type="pAtkSpd">325</stat>
            <stat type="randomDamage">20</stat>
            <stat type="pAtkRange">40</stat>
        </stats>
    </weapon>
</list>
