<?xml version="1.0" encoding="UTF-8"?>
<list xmlns:xsi="http://www.w3.org/2001/XMLSchema-instance" xsi:noNamespaceSchemaLocation="../../xsd/items.xsd">
	<item id="47826" name="Hanbok" type="Armor">
		<!-- Items to make a Hanbok Outfit. -->
		<set name="icon" val="icon.ev_kr_traditional_dress" />
		<set name="default_action" val="EQUIP" />
		<set name="armor_type" val="HEAVY" />
		<set name="bodypart" val="alldress" />
		<set name="immediate_effect" val="true" />
		<set name="material" val="BRONZE" />
		<set name="is_tradable" val="false" />
		<set name="is_dropable" val="false" />
		<set name="is_destroyable" val="false" />
		<set name="is_depositable" val="false" />
		<set name="is_sellable" val="false" />
		<set name="is_freightable" val="true" />
	</item>
</list>
